{
  "schemaVersion": "1.0",
  "source": "chatgpt-project-manual-import",
  "createdAt": "2026-06-29",
  "notes": "Example recipe showing how messy ingredient notes become grocery-planning data.",
  "recipes": [
    {
      "id": "beef-tacos",
      "title": "Beef Tacos",
      "aliases": ["Taco Night"],
      "overview": "A fast family taco night with seasoned ground beef, shells, rice, cheese, sour cream, and shredded romaine.",
      "minutes": 20,
      "timeBand": "20min",
      "servings": 5,
      "mealType": "dinner",
      "base": "Tacos",
      "protein": "Beef",
      "cuisine": "Tex-Mex",
      "difficulty": "easy",
      "planningValue": "family favorite",
      "tags": ["weeknight", "kid friendly", "taco night", "customizable"],
      "research": {
        "mode": "user-provided",
        "webResearchUsed": false,
        "query": "",
        "sourceLinks": [],
        "commonPatterns": [],
        "assumptions": [
          "Servings default to 5 for the household.",
          "One bag of shredded romaine is assumed because the original ingredient did not include a quantity.",
          "One packet or box of yellow rice is assumed because the package size was not specified."
        ],
        "copyrightNotes": "No web recipe text was used. Recipe is based on user-provided ingredient notes."
      },
      "ingredients": [
        {
          "original": "Taco Kit (hard & soft shells)",
          "displayName": "1 taco kit with hard and soft shells",
          "genericIngredient": "Taco kit",
          "quantityText": "1 kit",
          "quantityAmount": 1,
          "unit": "kit",
          "preparation": "",
          "preferences": ["hard shells", "soft shells", "taco seasoning included"],
          "optional": false,
          "pantryItem": false,
          "section": "Dry Goods",
          "role": "meal base",
          "productSearchTerms": ["taco dinner kit hard and soft shells", "taco kit", "stand and stuff taco kit"],
          "preferredProductTraits": ["includes hard shells", "includes soft tortillas", "includes taco seasoning"],
          "avoidProducts": ["taco seasoning only", "shells only unless no kit is available"],
          "substitutions": ["hard taco shells plus flour tortillas plus taco seasoning", "soft flour tortillas plus taco seasoning"],
          "quantityForShopping": "1 taco dinner kit",
          "confidence": "medium",
          "needsReview": true,
          "notes": "A kit is the likely shopping intent, but exact kit format may vary by store."
        },
        {
          "original": "1lb ground beef (85% lean)",
          "displayName": "1 lb 85% lean ground beef",
          "genericIngredient": "Ground beef",
          "quantityText": "1 lb",
          "quantityAmount": 1,
          "unit": "lb",
          "preparation": "",
          "preferences": ["85% lean"],
          "optional": false,
          "pantryItem": false,
          "section": "Protein",
          "role": "main protein",
          "productSearchTerms": ["85% lean ground beef 1 lb", "ground beef 85 lean"],
          "preferredProductTraits": ["85% lean", "1 lb package"],
          "avoidProducts": ["plant-based ground", "ground turkey", "ground chicken"],
          "substitutions": ["90% lean ground beef", "80% lean ground beef", "ground turkey"],
          "quantityForShopping": "1 lb package",
          "confidence": "high",
          "needsReview": false,
          "notes": ""
        },
        {
          "original": "1 pack yellow rice",
          "displayName": "1 pack yellow rice",
          "genericIngredient": "Yellow rice",
          "quantityText": "1 pack",
          "quantityAmount": 1,
          "unit": "pack",
          "preparation": "",
          "preferences": ["seasoned", "yellow rice mix"],
          "optional": false,
          "pantryItem": false,
          "section": "Dry Goods",
          "role": "starch",
          "productSearchTerms": ["yellow rice mix", "seasoned yellow rice packet"],
          "preferredProductTraits": ["seasoned yellow rice", "family-size if available"],
          "avoidProducts": ["plain white rice", "rice pudding", "microwave rice with unrelated flavor"],
          "substitutions": ["Spanish rice mix", "white rice with taco seasoning", "cilantro lime rice"],
          "quantityForShopping": "1 packet or box",
          "confidence": "medium",
          "needsReview": true,
          "notes": "Package size is unspecified."
        },
        {
          "original": "1 Shredded mexican cheese pack",
          "displayName": "1 pack shredded Mexican cheese",
          "genericIngredient": "Shredded Mexican cheese",
          "quantityText": "1 pack",
          "quantityAmount": 1,
          "unit": "pack",
          "preparation": "shredded",
          "preferences": ["Mexican blend"],
          "optional": false,
          "pantryItem": false,
          "section": "Dairy",
          "role": "dairy topping",
          "productSearchTerms": ["shredded Mexican cheese", "Mexican blend shredded cheese"],
          "preferredProductTraits": ["shredded", "Mexican blend", "resealable bag"],
          "avoidProducts": ["cheese slices", "block cheese unless shredding at home", "vegan cheese unless requested"],
          "substitutions": ["shredded cheddar", "shredded Monterey Jack", "shredded taco blend cheese"],
          "quantityForShopping": "1 bag, about 8 oz",
          "confidence": "high",
          "needsReview": false,
          "notes": ""
        },
        {
          "original": "1 cup sour cream",
          "displayName": "1 cup sour cream",
          "genericIngredient": "Sour cream",
          "quantityText": "1 cup",
          "quantityAmount": 1,
          "unit": "cup",
          "preparation": "",
          "preferences": ["plain"],
          "optional": false,
          "pantryItem": false,
          "section": "Dairy",
          "role": "sauce",
          "productSearchTerms": ["sour cream 16 oz", "plain sour cream"],
          "preferredProductTraits": ["plain", "tub"],
          "avoidProducts": ["sour cream dip", "flavored sour cream", "dairy-free unless requested"],
          "substitutions": ["plain Greek yogurt", "crema"],
          "quantityForShopping": "1 tub, about 16 oz",
          "confidence": "high",
          "needsReview": false,
          "notes": "Recipe uses 1 cup, but a tub is the practical shopping unit."
        },
        {
          "original": "Shredded romaine lettuce",
          "displayName": "shredded romaine lettuce",
          "genericIngredient": "Romaine lettuce",
          "quantityText": "1 bag",
          "quantityAmount": 1,
          "unit": "bag",
          "preparation": "shredded",
          "preferences": ["shredded", "washed if available"],
          "optional": false,
          "pantryItem": false,
          "section": "Produce",
          "role": "vegetable topping",
          "productSearchTerms": ["shredded romaine lettuce", "romaine lettuce"],
          "preferredProductTraits": ["shredded", "washed", "ready to use"],
          "avoidProducts": ["spring mix", "spinach", "coleslaw mix"],
          "substitutions": ["iceberg lettuce", "romaine hearts sliced at home", "shredded lettuce blend"],
          "quantityForShopping": "1 bag or 1 head",
          "confidence": "medium",
          "needsReview": true,
          "notes": "Quantity was not specified, so 1 bag is assumed for taco toppings."
        }
      ],
      "steps": [
        "Prepare the yellow rice according to package directions.",
        "Brown the ground beef in a skillet and season it with the taco seasoning from the kit.",
        "Warm the hard shells and soft tortillas according to package directions.",
        "Serve beef, rice, cheese, sour cream, and shredded romaine as build-your-own tacos."
      ],
      "reusePotential": ["taco bowls", "quesadillas", "nachos", "lunch burritos"],
      "pairsWellWith": ["chips and salsa", "fruit", "corn", "black beans"],
      "goodForDays": ["Monday", "Tuesday", "Friday"],
      "freshnessPriority": "medium",
      "makeAhead": ["Brown beef ahead", "Wash or shred lettuce ahead", "Cook rice ahead"],
      "kidFlex": "Serve components separately so kids can choose hard shell, soft tortilla, rice bowl, or plain beef and cheese.",
      "reviewStatus": "needs ingredient review",
      "notes": "Review taco kit preference and lettuce quantity before importing."
    }
  ]
}
